НОВИКОВ МИХАИЛ РОМАНОВИЧ;6607 358820;938092947 54;повышение температуры, одышка, головная боль, кашель;Терапевт;2024-12-09T17:55;общий анализ мочи, рентген грудной клетки, биохимический анализ крови, общий анализ крови;2024-12-12T09:15;3190;4377 7391 8279 1190
ЕГОРОВА АНАСТАСИЯ ВАСИЛЬЕВНА;4508 647697;110105563 73;повышение температуры, слабость, одышка, кашель;Терапевт;2024-01-18T13:00;рентген грудной клетки, общий анализ мочи, биохимический анализ крови, общий анализ крови;2024-01-21T10:25;3190;2200 5649 3128 3005
АНТОНОВА ЛЮДМИЛА АЛЕКСЕЕВНА;7810 785414;700343330 27;головная боль, одышка, слабость;Терапевт;2024-03-05T17:15;биохимический анализ крови, общий анализ крови, рентген грудной клетки;2024-03-07T09:10;2900;5228 6064 5583 6070
ЖУРАВЛЕВА ЛЮДМИЛА ДМИТРИЕВНА;6615 957724;396009107 86;сыпь, зуд;Дерматолог;2024-06-25T20:45;соскоб кожи на грибки;2024-06-28T10:20;700;4377 7339 4359 4474
ФРОЛОВ ИГОРЬ АЛЕКСАНДРОВИЧ;7812 815701;944238850 32;кровотечение, высокая температура, боль в животе, припухлость;Хирург;2024-12-10T10:30;УЗИ органов брюшной полости, биохимический анализ крови, общий анализ крови;2024-12-12T10:50;4200;4377 7376 7148 3067
АЛЕКСЕЕВ ЮРИЙ БОРИСОВИЧ;7716 759434;779628536 85;лихорадка, насморк, кашель, сыпь;Педиатр;2024-07-17T12:35;общий анализ мочи, мазок из носа/горла, биохимический анализ крови, общий анализ крови;2024-07-18T12:20;2890;4986 2926 7560 2554
КОЗЛОВ ГЕОРГИЙ ВЛАДИСЛАВОВИЧ;4017 343816;309612421 55;потеря аппетита, кашель;Педиатр;2024-03-02T09:40;общий анализ крови, мазок из носа/горла, биохимический анализ крови, общий анализ мочи;2024-03-04T09:00;2890;5211 9437 6405 2683
АНДРЕЕВ АЛЕКСЕЙ СЕРГЕЕВИЧ;5019 633016;150290184 28;головные боли у детей;Детский невролог;2024-09-24T14:40;МРТ головного мозга, общий анализ крови;2024-09-26T12:20;8350;5389 9441 6117 1238
ВОРОБЬЕВ СЕРГЕЙ НИКОЛАЕВИЧ;5918 310577;701595603 85;слабость, одышка, кашель, повышение температуры;Терапевт;2024-08-03T17:15;биохимический анализ крови, рентген грудной клетки, общий анализ крови;2024-08-05T11:05;2900;4306 4330 3509 1470
КОЗЛОВА НИНА ИЛЬИНИЧНА;5023 930737;097010492 57;необходимость удаления зуба, отек, зубная боль;Стоматолог-хирург;2024-06-07T17:05;биохимический анализ крови, общий анализ крови, рентген зубов;2024-06-09T09:30;2400;5228 6042 2079 4372
СОКОЛОВ АНДРЕЙ ДМИТРИЕВИЧ;4015 135648;446109093 72;сыпь, зуд, шелушение;Дерматолог;2024-08-06T10:30;общий анализ крови;2024-08-08T09:25;850;2200 7024 5228 1905
МАКСИМОВ СТАНИСЛАВ ИВАНОВИЧ;5912 935054;735334488 05;панические атаки, бессонница, депрессия;Психиатр;2024-01-05T12:45;общий анализ крови, психодиагностика;2024-01-08T09:00;5850;2200 7020 2358 3565
ОРЛОВА АННА ЮРЬЕВНА;4509 612726;113153129 97;одышка, повышение температуры, слабость, головная боль;Терапевт;2024-03-05T14:50;общий анализ крови, рентген грудной клетки, общий анализ мочи;2024-03-08T11:25;2340;4039 3393 1400 1496
НИКИТИНА МАРИНА НИКОЛАЕВНА;5025 186767;196379357 36;выделения из сосков, боль в груди, уплотнения;Маммолог;2024-04-29T14:20;общий анализ крови, маммография;2024-05-01T11:40;4350;5112 2381 3128 7185
КИСЕЛЕВ АНДРЕЙ АЛЕКСАНДРОВИЧ;4522 320610;739990172 66;нарушения сна, стресс, тревога;Психотерапевт;2024-06-14T16:40;общий анализ крови, психодиагностика;2024-06-16T10:40;5850;4377 7349 7181 6541
БОРИСОВА НАДЕЖДА ДМИТРИЕВНА;6618 590322;119302422 23;головная боль;Терапевт;2024-03-24T15:10;биохимический анализ крови;2024-03-25T12:25;850;2200 5686 4222 4015
ЕГОРОВА ИРИНА БОРИСОВНА;4017 333250;880559744 58;зуд, слезотечение, заложенность носа, кожная сыпь;Аллерголог-иммунолог;2024-01-11T17:40;общий анализ крови;2024-01-14T12:20;850;2200 5679 3132 8702
МИХАЙЛОВА ГАЛИНА ПАВЛОВНА;4710 739554;544448835 14;сыпь, потеря аппетита;Педиатр;2024-10-29T17:45;мазок из носа/горла;2024-10-30T12:10;900;2200 5612 7857 8656
СОКОЛОВ СЕРГЕЙ НИКОЛАЕВИЧ;6613 791339;052060614 07;ограничение движений, спазмы мышц;Мануальный терапевт;2024-09-23T11:05;общий анализ крови;2024-09-25T12:05;850;5211 9463 8672 8883
СОКОЛОВ АЛЕКСАНДР ВЛАДИМИРОВИЧ;4515 679315;086662288 08;слабость, головная боль;Терапевт;2024-07-02T18:55;рентген грудной клетки, биохимический анализ крови;2024-07-04T10:30;2050;4306 4386 4897 3963
СМИРНОВА МАРИЯ МИХАЙЛОВНА;4013 251914;396424193 13;одышка, кашель, слабость, головная боль;Терапевт;2024-06-27T15:20;рентген грудной клетки, общий анализ мочи, общий анализ крови, биохимический анализ крови;2024-06-29T11:30;3190;5112 2326 7241 3837
ГУСЕВА НИНА ИГОРЕВНА;4522 922872;901752953 01;зуд, слезотечение, кожная сыпь, отек, частые простуды, заложенность носа;Аллерголог-иммунолог;2024-10-19T21:10;аллергопробы, общий анализ крови;2024-10-22T12:00;2850;5211 9422 3930 9715
ПАВЛОВА НАДЕЖДА БОРИСОВНА;7807 347460;064965904 09;подбор терапии при диабете, частое мочеиспускание, усталость, жажда;Диабетолог;2024-02-13T15:20;анализа на гликированный гемоглобин;2024-02-15T12:20;900;4039 3381 1757 5039
СОРОКИН ВИКТОР ЕВГЕНЬЕВИЧ;4015 615016;315954026 74;увеличение лимфоузлов, слабость, синяки;Гематолог;2024-12-25T19:05;коагулограмма, общий анализ крови;2024-12-28T11:05;1650;5112 2396 4153 6361
ЗАХАРОВА ЕЛЕНА АЛЕКСАНДРОВНА;4708 865056;100645033 94;длительная лихорадка, слабость, хрипы, одышка;Пульмонолог;2024-02-06T14:10;спирометрия, рентген грудной клетки;2024-02-08T10:15;3000;4039 3316 4814 5501
АНТОНОВ МАКСИМ ВИКТОРОВИЧ;6613 163083;411439753 59;зуд;Гинеколог;2024-05-09T18:15;мазок на флору, УЗИ органов малого таза, общий анализ крови;2024-05-11T12:00;3950;4306 4342 8623 7672
СОРОКИН АЛЕКСЕЙ АЛЕКСАНДРОВИЧ;4518 809539;634433406 74;повышение температуры, головная боль;Терапевт;2024-11-25T09:55;общий анализ мочи, биохимический анализ крови, рентген грудной клетки, общий анализ крови;2024-11-28T11:20;3190;2200 5656 5620 8884
АЛЕКСЕЕВ ВИТАЛИЙ АЛЕКСЕЕВИЧ;5919 129330;615659728 25;головная боль, кашель, слабость;Терапевт;2024-12-02T17:15;биохимический анализ крови, общий анализ крови, рентген грудной клетки, общий анализ мочи;2024-12-04T12:30;3190;4306 4398 1751 4106
ЖУРАВЛЕВА ГАЛИНА АЛЕКСАНДРОВНА;6613 479860;462322992 80;боль в суставах, деформации, нарушение движений, отеки, боль после травмы;Травматолог-ортопед;2024-01-20T12:20;рентген сустава;2024-01-22T11:20;1500;4986 2911 4248 6665
ИВАНОВА НАТАЛЬЯ ГЕННАДЬЕВНА;6613 835442;154451361 51;слабость;Невролог;2024-08-20T20:05;общий анализ крови;2024-08-22T12:10;850;2200 5699 6319 5098
СМИРНОВ ВЛАДИМИР ИВАНОВИЧ;4519 697124;443018763 61;слабость, головная боль, кашель, повышение температуры;Терапевт;2024-02-05T09:20;рентген грудной клетки, общий анализ мочи, биохимический анализ крови, общий анализ крови;2024-02-07T09:20;3190;5112 2387 9771 9941
МИХАЙЛОВ ЭДУАРД АЛЕКСЕЕВИЧ;7721 376558;821113261 36;ограничение движений, спазмы мышц, головные боли, боли в спине;Мануальный терапевт;2024-09-09T17:20;общий анализ крови, МРТ позвоночника;2024-09-12T11:50;7350;5211 9450 7500 7949
БЕЛОВ АНДРЕЙ ВИКТОРОВИЧ;7711 251224;915456336 16;кашель;Педиатр;2024-09-06T10:35;общий анализ мочи, общий анализ крови, биохимический анализ крови, мазок из носа/горла;2024-09-08T11:25;2890;5211 9426 1942 4597
МОРОЗОВА ЛЮБОВЬ ВАЛЕРЬЕВНА;4709 543810;441739065 84;частое мочеиспускание, набор веса;Эндокринолог;2024-11-18T18:15;ТТГ, анализ на гормоны щитовидной железы;2024-11-21T09:25;1910;5228 6088 1736 2073
ФРОЛОВ АЛЕКСАНДР АЛЕКСАНДРОВИЧ;5919 241607;614741165 75;чувствительность зубов, зубная боль;Стоматолог;2024-03-03T16:20;рентген зубов, общий анализ крови;2024-03-05T11:15;1550;4986 2962 8917 9723
ЕГОРОВА ЕЛЕНА АНАТОЛЬЕВНА;5908 692201;312875565 83;боль после травмы, деформации;Травматолог-ортопед;2024-12-24T12:20;общий анализ крови, рентген сустава;2024-12-26T10:45;2350;2200 5654 2510 2047
СИДОРОВА ГАЛИНА ИВАНОВНА;7714 219280;161541272 39;головная боль, кашель, слабость, повышение температуры, одышка;Терапевт;2024-06-10T15:40;общий анализ крови, рентген грудной клетки;2024-06-12T09:50;2050;4039 3378 4171 9063
СОКОЛОВА ЛЮДМИЛА АНАТОЛЬЕВНА;4718 117320;282364442 81;боль в горле, заложенность носа, снижение слуха, головокружение;Оториноларинголог (ЛОР);2024-01-06T12:45;мазок из зева, аудиометрия;2024-01-08T11:35;2000;4306 4354 8003 9813
КОЗЛОВА КРИСТИНА АЛЕКСЕЕВНА;4022 581438;523643308 66;кровотечения;Акушер-гинеколог;2024-01-31T12:50;общий анализ крови;2024-02-01T11:45;850;4986 2950 5633 3722
КУЗНЕЦОВ АЛЕКСАНДР АЛЕКСАНДРОВИЧ;4515 302095;439561785 27;лихорадка, сыпь;Педиатр;2024-09-11T12:55;общий анализ мочи, биохимический анализ крови;2024-09-14T09:50;1140;2200 7033 3072 4898
СОКОЛОВ СЕРГЕЙ НИКОЛАЕВИЧ;6613 791339;052060614 07;головная боль, повышение температуры;Терапевт;2024-02-18T09:15;биохимический анализ крови, общий анализ мочи, рентген грудной клетки, общий анализ крови;2024-02-19T12:55;3190;4306 4378 7613 8672
ГУСЕВА ОЛЬГА ВЛАДИМИРОВНА;5919 152511;161516948 65;боль после травмы;Травматолог-ортопед;2024-12-11T18:55;МРТ сустава, рентген сустава, общий анализ крови;2024-12-13T11:30;8850;2202 2025 5327 4647
ВОЛКОВА НАТАЛЬЯ ВАЛЕРЬЕВНА;5024 277123;492418456 09;слабость, ограничение движений, боли после перенесенных заболеваний, одышка;Реабилитолог;2024-08-26T17:35;механотерапия на аппарате с электроприводом;2024-08-28T10:40;600;5389 9436 2450 6062
СМИРНОВ АНДРЕЙ ИВАНОВИЧ;4515 861098;779730325 55;высокая температура, боль в животе;Хирург;2024-09-10T10:15;общий анализ крови;2024-09-13T09:45;850;2202 2065 8532 7959
ЗАХАРОВА ЛАРИСА ФЕДОРОВНА;7810 816273;340451972 54;заложенность носа;Оториноларинголог (ЛОР);2024-06-30T20:15;мазок из зева, аудиометрия;2024-07-03T11:30;2000;2200 5639 2861 6706
КУЗНЕЦОВ АНАТОЛИЙ АЛЕКСАНДРОВИЧ;7817 602716;998562826 08;депрессия, проблемы в отношениях, тревога, стресс, нарушения сна;Психотерапевт;2024-03-07T16:50;общий анализ крови, психодиагностика;2024-03-08T09:50;5850;2200 4066 7123 6023
КИСЕЛЕВ ВИКТОР АЛЕКСАНДРОВИЧ;7809 511225;368742425 20;лишний вес;Диетолог;2024-05-07T11:40;биохимический анализ крови, общий анализ крови;2024-05-09T11:40;1700;2200 4091 2273 2720
НОВИКОВА ЛЮДМИЛА ЛЬВОВНА;4020 145543;774273734 35;покраснение глаз, ощущение песка, ухудшение зрения, слезотечение;Офтальмолог;2024-08-22T12:50;томография глаза;2024-08-25T12:40;400;5112 2329 5159 4159
ВОРОБЬЕВА ОЛЬГА ВЛАДИМИРОВНА;7720 129352;708144020 64;расшифровка ЭКГ;Врач функциональной диагностики;2024-11-03T09:15;ЭКГ;2024-11-06T12:30;1500;2200 7040 2434 3309
ВОЛКОВ СЕРГЕЙ АНАТОЛЬЕВИЧ;5916 454422;243077542 58;наследственные заболевания;Генетик;2024-06-26T09:30;генетический анализ, общий анализ крови;2024-06-27T09:30;12850;2202 2037 6542 1933
КОМАРОВ ИВАН СЕРГЕЕВИЧ;5013 169241;761669029 31;шелушение, сыпь;Дерматолог;2024-01-12T13:00;соскоб кожи на грибки, общий анализ крови;2024-01-14T10:50;1550;2200 5645 8285 5541
ПОПОВА ЛИДИЯ АНДРЕЕВНА;4014 721102;502339863 66;спутанность сознания;Токсиколог;2024-06-05T17:30;общий анализ крови, биохимический анализ крови;2024-06-08T11:55;1700;4986 2998 4065 1432
ПЕТРОВА ОЛЕСЯ ВИКТОРОВНА;5012 166723;148716312 80;потеря аппетита;Педиатр;2024-02-17T10:05;мазок из носа/горла, биохимический анализ крови;2024-02-19T09:15;1750;4039 3362 6686 5289
СОРОКИН ГЕННАДИЙ СЕРГЕЕВИЧ;7820 331321;862101336 64;запор, диарея, изжога, вздутие, боль в животе, тошнота, рвота;Гастроэнтеролог;2024-07-24T13:25;биохимический анализ крови, ФГДС, общий анализ крови, УЗИ органов брюшной полости;2024-07-26T11:45;9700;4986 2928 2333 9803
ВАСИЛЬЕВ ГРИГОРИЙ АЛЕКСАНДРОВИЧ;6608 540463;194591740 15;боль в животе;Хирург;2024-04-25T10:00;коагулограмма;2024-04-27T09:00;800;2200 5670 7542 2482
БОРИСОВА НАДЕЖДА ДМИТРИЕВНА;6618 590322;119302422 23;нарушение движений, боль после травмы, деформации, отеки;Травматолог-ортопед;2024-09-12T15:30;общий анализ крови, рентген сустава, МРТ сустава;2024-09-13T10:25;8850;4039 3311 1607 5717
ВОЛКОВ СЕРГЕЙ АНАТОЛЬЕВИЧ;5916 454422;243077542 58;сыпь, зуд;Дерматолог;2024-10-14T10:05;общий анализ крови, соскоб кожи на грибки;2024-10-16T11:05;1550;2200 4028 1881 3819
ИВАНОВА СВЕТЛАНА АЛЕКСЕЕВНА;5009 142790;370729239 91;боль в суставах, деформации;Травматолог-ортопед;2024-04-23T17:20;рентген сустава, МРТ сустава;2024-04-25T11:25;8000;2200 7019 7965 9970
КОЗЛОВА НИНА ИЛЬИНИЧНА;5023 930737;097010492 57;жажда;Эндокринолог;2024-09-08T16:50;глюкоза крови;2024-09-09T12:55;260;4377 7318 7696 5604
НИКОЛАЕВА ВЕРА НИКОЛАЕВНА;4008 515243;101749491 44;длительные боли, родинки;Онколог;2024-01-01T18:30;онкомаркеры, биохимический анализ крови, общий анализ крови;2024-01-04T11:30;4100;5112 2345 4436 5321
МИХАЙЛОВА ГАЛИНА ПАВЛОВНА;4710 739554;544448835 14;боль в горле, снижение слуха, головокружение;Оториноларинголог (ЛОР);2024-08-12T09:00;мазок из зева, аудиометрия;2024-08-14T11:50;2000;4039 3326 9854 7975
ЕГОРОВ АРТУР ИВАНОВИЧ;4023 763156;045979754 25;боли в груди, одышка при нагрузке, шумы в сердце у ребенка, синеватый оттенок кожи;Детский кардиолог;2024-02-21T10:50;общий анализ крови, ЭКГ;2024-02-24T10:25;2350;4306 4323 8618 5665
АБРАМОВ АЛЕКСАНДР ВАЛЕРЬЕВИЧ;4707 658167;439522749 07;лихорадка, кашель;Педиатр;2024-12-25T12:40;общий анализ мочи, биохимический анализ крови, общий анализ крови, мазок из носа/горла;2024-12-27T10:15;2890;2200 7032 5331 1196
МОРОЗОВА ВАЛЕРИЯ ВАЛЕРЬЕВНА;4725 308608;565430653 97;сыпь;Педиатр;2024-06-02T11:40;общий анализ крови, общий анализ мочи, биохимический анализ крови, мазок из носа/горла;2024-06-03T12:20;2890;4039 3396 6132 4898
ФРОЛОВА ТАТЬЯНА СЕРГЕЕВНА;6624 487661;551305143 43;повышение температуры;Терапевт;2024-04-03T21:35;рентген грудной клетки, биохимический анализ крови, общий анализ крови, общий анализ мочи;2024-04-06T09:10;3190;2202 2047 8960 4737
СОКОЛОВ АЛЕКСЕЙ АЛЕКСАНДРОВИЧ;5924 784161;485207987 23;кровотечение, боль в животе;Хирург;2024-09-27T19:25;коагулограмма;2024-09-29T09:25;800;2200 5676 7048 7222
ИВАНОВ СЕРГЕЙ СЕРГЕЕВИЧ;6619 164957;858564872 82;зубная боль, чувствительность зубов, кровоточивость десен;Стоматолог;2024-01-18T16:20;рентген зубов;2024-01-21T10:05;700;5228 6011 2414 4750
КОРОЛЕВ ОЛЕГ ВЛАДИМИРОВИЧ;7725 769252;809735836 46;нарушение движений, боль после травмы;Травматолог-ортопед;2024-08-10T21:05;рентген сустава;2024-08-12T09:00;1500;5112 2380 3166 5940
ЕГОРОВ БОРИС ОЛЕГОВИЧ;5925 316052;828957444 73;потеря аппетита;Педиатр;2024-04-28T17:45;мазок из носа/горла, общий анализ мочи, общий анализ крови;2024-04-30T12:45;2040;5228 6045 7567 4192
ИВАНОВА ЗИНАИДА ВЛАДИМИРОВНА;7824 414180;233555067 56;уплотнения;Маммолог;2024-10-08T18:20;общий анализ крови, маммография;2024-10-10T11:20;4350;4306 4330 9856 1874
КУЗЬМИНА АНТОНИНА ВАСИЛЬЕВНА;7714 982197;503467557 79;кровотечение, припухлость;Хирург;2024-05-28T10:15;коагулограмма, биохимический анализ крови, УЗИ органов брюшной полости;2024-05-29T10:15;4150;2200 4097 5169 6136
МИХАЙЛОВА ЛЮБОВЬ АЛЕКСАНДРОВНА;7823 204977;338930250 91;головокружение, слабость, онемение конечностей;Невролог;2024-11-12T12:10;биохимический анализ крови, МРТ головного мозга, общий анализ крови;2024-11-14T10:25;9200;2200 4055 2261 1102
БОРИСОВ МИХАИЛ НИКОЛАЕВИЧ;5010 835177;441453900 62;боль в животе, вздутие, рвота, тошнота, диарея, запор, изжога;Гастроэнтеролог;2024-11-06T21:35;биохимический анализ крови;2024-11-08T11:10;850;5112 2374 6186 1500
ЖУКОВА ЮЛИЯ СЕРГЕЕВНА;4019 646795;347437346 97;боль в суставах, деформации;Травматолог-ортопед;2024-11-07T15:35;МРТ сустава, рентген сустава;2024-11-09T10:35;8000;4377 7375 5246 2076
МОРОЗОВА ЛАРИСА АЛЕКСАНДРОВНА;7708 317134;658418853 46;боль при мочеиспускании;Уролог;2024-08-18T21:30;бактериологический посев мочи, общий анализ мочи;2024-08-20T12:05;1190;2200 4095 3540 5190
ТАРАСОВ СЕРГЕЙ ЕВГЕНЬЕВИЧ;7819 863571;966287958 94;кашель, одышка;Терапевт;2024-06-14T13:35;биохимический анализ крови;2024-06-16T12:00;850;4306 4372 5674 8578
СТЕПАНОВА АННА ВЛАДИМИРОВНА;4723 357414;335577792 18;высокое давление, одышка, аритмия, боль в груди, головокружение, отеки ног;Кардиолог;2024-12-11T20:50;общий анализ крови, ЭКГ, биохимический анализ крови, эхокардиография;2024-12-13T10:15;7700;2200 5659 4417 2948
КУЗНЕЦОВА ТАТЬЯНА ГРИГОРЬЕВНА;5913 501304;939315995 59;одышка, головная боль;Терапевт;2024-02-01T13:35;биохимический анализ крови, общий анализ мочи, общий анализ крови;2024-02-03T11:55;1990;5112 2394 7201 4219
ЗАЙЦЕВА МАРИНА АЛЕКСАНДРОВНА;5010 134698;513032398 31;проблемы в отношениях, депрессия, стресс;Психотерапевт;2024-06-25T17:15;общий анализ крови;2024-06-28T10:55;850;5228 6041 5029 5171
ЕГОРОВА ЕВГЕНИЯ НИКОЛАЕВНА;7713 357760;083868640 19;одышка;Терапевт;2024-07-31T13:35;общий анализ крови, биохимический анализ крови, общий анализ мочи;2024-08-02T09:20;1990;2200 5693 9009 3426
ИВАНОВ ЕВГЕНИЙ ЮРЬЕВИЧ;7708 386444;725381846 12;потеря аппетита, сыпь;Педиатр;2024-03-14T10:25;биохимический анализ крови, общий анализ крови, мазок из носа/горла;2024-03-16T09:50;2600;4039 3345 6868 8285
ВОРОБЬЕВ СЕРГЕЙ АЛЕКСАНДРОВИЧ;7814 174843;753139384 08;слабость;Терапевт;2024-02-12T18:20;общий анализ крови, биохимический анализ крови, рентген грудной клетки;2024-02-14T09:45;2900;2200 4087 1968 5065
БАРАНОВА НАТАЛИЯ СЕРГЕЕВНА;5912 649860;933740473 15;составление программ восстановительной гимнастики;Врач ЛФК;2024-08-28T09:45;индивидуальное занятие ЛФК (30 минут);2024-08-31T11:55;2600;2200 5619 9478 8861
ИВАНОВА ДАРЬЯ ГРИГОРЬЕВНА;5009 586732;504005290 16;кашель, одышка, головная боль, повышение температуры;Терапевт;2024-07-07T14:50;биохимический анализ крови;2024-07-09T12:50;850;2202 2038 1216 4524
