Арефий Валентинович Ковалев;5013 112064;767-608-519 58;недержание, кровотечения;Колопроктолог;2024-12-31T16:36;общий анализ крови;2024-05-07T16:20;850;2202 2066 4144 6839
Виктория Архиповна Белоусова;5912 349978;162-860-246 28;родинки, длительные боли;Онколог;2024-03-29T15:59;биохимический анализ крови, общий анализ крови, онкомаркеры;2024-07-19T10:52;4100;2200 5698 6525 5540
Лобанова Тамара Архиповна;4022 483775;130-039-737 10;боль в животе, кровотечение, припухлость, высокая температура;Хирург;2024-10-16T18:01;общий анализ крови, УЗИ органов брюшной полости, коагулограмма;2024-08-19T19:51;4150;2200 5694 6249 2034
Еремей Борисович Сазонов;6625 263690;882-422-455 86;кашель;Терапевт;2024-07-05T12:03;общий анализ крови;2024-12-14T11:38;850;2200 4053 4482 7931
Викентий Евстигнеевич Ситников;7822 380013;321-024-445 16;лихорадка, потеря аппетита;Педиатр;2024-08-09T13:03;общий анализ крови, биохимический анализ крови;2024-10-24T20:19;1700;2200 7037 7039 4141
Никифоров Рюрик Данилович;6623 348634;405-628-800 36;одышка, повышение температуры, кашель;Терапевт;2024-09-03T11:51;общий анализ крови, общий анализ мочи, биохимический анализ крови;2024-04-28T10:19;1990;2200 5663 5842 4508
Марков Евграф Трифонович;4515 965006;271-657-901 68;повышение температуры, головная боль, одышка;Терапевт;2024-05-16T10:37;рентген грудной клетки, общий анализ крови, биохимический анализ крови;2024-08-14T13:05;2900;4039 3322 9625 2959
Евпраксия Юльевна Корнилова;4713 807729;825-005-174 47;лихорадка;Педиатр;2024-10-26T19:34;биохимический анализ крови, мазок из носа/горла, общий анализ крови;2024-12-16T20:54;2600;4377 7371 5999 3540
г-н Агафонов Леон Якубович;6620 953947;166-438-205 76;кашель, одышка, слабость, повышение температуры, головная боль;Терапевт;2024-02-12T11:02;общий анализ мочи, рентген грудной клетки;2024-02-12T16:36;1490;4306 4337 8400 8333
София Андреевна Симонова;4013 262819;764-042-967 61;тревога;Психиатр;2024-01-20T20:18;психодиагностика, общий анализ крови;2024-04-29T12:53;5850;4306 4383 8194 7808
