ЛЕБЕДЕВА МАРИНА ИГОРЕВНА;5012 137200;111856149 40;недостаток веса, пищевая непереносимость, лишний вес, нарушения пищеварения;Диетолог;2024-08-08T13:25;биохимический анализ крови;2024-08-10T12:20;850;2200 5623 7730 1713
КОМАРОВ АЛЕКСАНДР АЛЕКСЕЕВИЧ;7708 416714;189069256 22;кашель, потеря аппетита, сыпь, лихорадка, насморк;Педиатр;2024-10-05T17:15;мазок из носа/горла, общий анализ крови, общий анализ мочи, биохимический анализ крови;2024-10-07T12:40;2890;4306 4329 7460 4090
ЗАЙЦЕВА МАРИНА АЛЕКСАНДРОВНА;5010 134698;513032398 31;повышение температуры;Терапевт;2024-10-28T18:15;общий анализ крови, биохимический анализ крови, рентген грудной клетки, общий анализ мочи;2024-10-31T10:25;3190;4306 4383 3633 4685
СТЕПАНОВА МАРИЯ ИВАНОВНА;4722 472293;369850000 09;слабость, головная боль, повышение температуры, кашель, одышка;Терапевт;2024-02-13T19:00;общий анализ крови;2024-02-15T09:40;850;5211 9490 9481 5451
НОВИКОВА ЕКАТЕРИНА НИКОЛАЕВНА;5009 105794;847473539 52;боль после травмы, деформации, отеки, боль в суставах, нарушение движений;Травматолог-ортопед;2024-07-09T13:50;рентген сустава, МРТ сустава, общий анализ крови;2024-07-11T11:25;8850;2200 7063 5910 6355
КИСЕЛЕВ АНДРЕЙ АЛЕКСАНДРОВИЧ;4522 320610;739990172 66;заложенность носа, головокружение, боль в горле;Оториноларинголог (ЛОР);2024-02-19T11:40;мазок из зева, аудиометрия;2024-02-21T10:05;2000;2200 7042 8155 5049
БЕЛОВА ЗИНАИДА ИВАНОВНА;4716 364234;124457600 47;кашель;Терапевт;2024-09-08T21:00;рентген грудной клетки;2024-09-11T12:00;1200;4306 4326 8343 6623
СОЛОВЬЕВ ВАСИЛИЙ ЮРЬЕВИЧ;4714 825485;835666549 51;припухлость, боль в животе, высокая температура, кровотечение;Хирург;2024-03-20T10:50;биохимический анализ крови, общий анализ крови, коагулограмма, УЗИ органов брюшной полости;2024-03-22T11:30;5000;2200 4044 2010 5902
ЛЕБЕДЕВА МАРИНА ИГОРЕВНА;5012 137200;111856149 40;кашель;Терапевт;2024-02-12T20:45;общий анализ крови, общий анализ мочи, биохимический анализ крови, рентген грудной клетки;2024-02-14T10:10;3190;4306 4364 1846 4700
АНДРЕЕВ АЛЕКСЕЙ СЕРГЕЕВИЧ;5019 633016;150290184 28;снижение веса, родинки, длительные боли, необычные уплотнения;Онколог;2024-11-02T16:45;общий анализ крови;2024-11-05T09:00;850;2202 2052 2424 7711
ЖУРАВЛЕВА ОЛЬГА НИКОЛАЕВНА;4523 264333;148510565 63;абстиненция, зависимость от препаратов, проблемы с алкоголем, проблемы с курением;Нарколог;2024-07-19T11:40;биохимический анализ крови, общий анализ крови;2024-07-21T12:20;1700;2200 7039 9791 3158
НОВИКОВА ЕКАТЕРИНА НИКОЛАЕВНА;5009 105794;847473539 52;боль после травмы, деформации, отеки, боль в суставах, нарушение движений;Травматолог-ортопед;2024-01-08T10:00;общий анализ крови, МРТ сустава, рентген сустава;2024-01-09T12:20;8850;2200 5627 7727 2640
ФРОЛОВ АЛЕКСАНДР АЛЕКСАНДРОВИЧ;5919 241607;614741165 75;потеря аппетита, сыпь;Педиатр;2024-08-08T13:20;биохимический анализ крови, мазок из носа/горла, общий анализ крови;2024-08-11T09:45;2600;4377 7343 5445 7340
БОРИСОВА ГАЛИНА ВИКТОРОВНА;5009 847246;798332344 51;высокая температура;Хирург;2024-01-22T10:35;УЗИ органов брюшной полости, общий анализ крови, биохимический анализ крови;2024-01-25T12:25;4200;4306 4330 8824 6179
КУЛИКОВА АЛИНА АФАНАСЬЕВНА;5910 597986;636449497 35;повышение температуры, одышка, кашель;Терапевт;2024-10-31T20:30;рентген грудной клетки, общий анализ мочи, общий анализ крови, биохимический анализ крови;2024-11-03T12:10;3190;4986 2962 9358 9924
НИКОЛАЕВА НАТАЛЬЯ НИКОЛАЕВНА;7817 878922;179675972 60;повышение температуры, кашель, одышка, слабость;Терапевт;2024-09-06T19:10;общий анализ крови, рентген грудной клетки;2024-09-09T10:55;2050;2200 5670 4698 1216
КУЗЬМИНА СВЕТЛАНА ФЕДОРОВНА;4516 696700;096293475 12;деформации, отеки, боль в суставах;Травматолог-ортопед;2024-03-30T15:45;общий анализ крови, рентген сустава, МРТ сустава;2024-04-02T09:40;8850;4306 4335 5599 4230
МИХАЙЛОВ АНДРЕЙ ИЛЬИЧ;7819 175195;768080326 24;боль;Офтальмолог;2024-04-04T20:15;томография глаза, офтальмоскопия;2024-04-07T09:15;1000;5211 9418 7517 5720
НИКОЛАЕВА ЮЛИЯ ВЛАДИМИРОВНА;4715 158841;696635491 68;боль в животе, высокая температура;Хирург;2024-03-05T18:10;УЗИ органов брюшной полости, коагулограмма, общий анализ крови, биохимический анализ крови;2024-03-08T12:10;5000;5211 9444 5368 4058
КОЗЛОВ СЕРГЕЙ МИХАЙЛОВИЧ;7823 279048;947881643 81;боль в животе;Хирург;2024-11-28T17:50;общий анализ крови;2024-11-30T11:20;850;5112 2365 3710 2849
МИХАЙЛОВА ИННА МИХАЙЛОВНА;6619 112976;465842239 14;сыпь, кашель, лихорадка, насморк;Педиатр;2024-09-05T11:35;общий анализ мочи, мазок из носа/горла;2024-09-06T10:55;1190;4039 3328 2305 2817
ВОРОБЬЕВА АЛИНА МИХАЙЛОВНА;7716 214721;355192077 81;припухлость, высокая температура, боль в животе;Хирург;2024-04-26T12:20;коагулограмма, УЗИ органов брюшной полости;2024-04-28T10:35;3300;2200 7016 7744 9330
ФЕДОРОВ АЛЕКСАНДР АНДРЕЕВИЧ;6609 940080;092541243 56;отеки, нарушение движений, боль после травмы;Травматолог-ортопед;2024-06-01T20:40;общий анализ крови, МРТ сустава, рентген сустава;2024-06-04T09:40;8850;2202 2081 1229 9439
КОРОЛЕВА ЕЛЕНА ВАСИЛЬЕВНА;4012 110015;629419380 21;тошнота, запор, боль в животе, вздутие, рвота;Гастроэнтеролог;2024-04-07T17:40;биохимический анализ крови;2024-04-09T10:45;850;4306 4339 1473 8130
СОКОЛОВ ОЛЕГ ВАЛЕРЬЕВИЧ;5021 942017;936391681 47;перхоть, облысение, заболевания кожи головы;Трихолог;2024-04-14T18:50;общий анализ крови, соскоб кожи;2024-04-16T12:55;1550;2200 5632 4561 8347
ФРОЛОВА ТАТЬЯНА ВЛАДИСЛАВОВНА;5019 900862;650116020 32;кровотечение, высокая температура, боль в животе, припухлость;Хирург;2024-03-11T15:45;коагулограмма, общий анализ крови;2024-03-13T10:40;1650;4039 3392 3008 7181
КОЗЛОВА ЗОЯ ВИКТОРОВНА;6622 435683;310853987 69;пигментация, акне;Косметолог;2024-02-02T17:25;общий анализ крови, соскоб кожи;2024-02-03T09:20;1550;2202 2027 3661 6585
СТЕПАНОВА МАРИЯ АЛЕКСЕЕВНА;7814 775314;627955060 28;сложные случаи геморроя, боль в области прямой кишки;Колопроктолог;2024-03-10T14:35;колоноскопия;2024-03-13T12:35;7500;4306 4372 6149 5263
ЖУКОВА ЛЮДМИЛА ЯКОВЛЕВНА;5018 200342;592770741 36;слабость, длительный кашель, потеря веса, ночная потливость, кровохарканье;Фтизиатр;2024-07-28T12:40;общий анализ крови;2024-07-30T12:40;850;4306 4359 9147 5748
МОРОЗОВА НАТАЛЬЯ ГЕОРГИЕВНА;7714 960854;961572209 22;одышка, кашель, повышение температуры;Терапевт;2024-10-28T09:50;общий анализ крови, общий анализ мочи, биохимический анализ крови;2024-10-30T12:05;1990;4377 7315 6877 5678
МАКСИМОВА АНАСТАСИЯ АНАТОЛЬЕВНА;4022 425079;990181212 11;кашель, повышение температуры;Терапевт;2024-11-27T18:10;общий анализ мочи, общий анализ крови, рентген грудной клетки;2024-11-29T11:35;2340;2200 5630 1336 6223
СОЛОВЬЕВА ЕВДОКИЯ НИКОЛАЕВНА;4520 388258;538997466 80;кашель;Терапевт;2024-12-11T17:40;биохимический анализ крови;2024-12-13T12:50;850;2200 4017 5567 2172
БОРИСОВ ДМИТРИЙ МИХАЙЛОВИЧ;4025 184371;090539045 65;лихорадка, насморк, кашель, сыпь;Педиатр;2024-12-20T16:30;общий анализ крови;2024-12-23T09:10;850;5112 2377 1191 1159
ЛЕБЕДЕВ АЛЕКСЕЙ ФЕДОРОВИЧ;4521 461056;990216225 07;сердечно-сосудистые заболевания;Кардиолог-геронтолог;2024-03-16T19:25;общий анализ крови, ЭКГ;2024-03-19T10:05;2350;2200 4054 5153 2330
ЖУКОВ ВЛАДИМИР ЯКОВЛЕВИЧ;7716 608837;507947953 34;слабость, одышка, повышение температуры, головная боль, кашель;Терапевт;2024-01-16T11:40;биохимический анализ крови, рентген грудной клетки, общий анализ мочи, общий анализ крови;2024-01-17T10:50;3190;5112 2362 1252 1905
ВОРОБЬЕВА АЛИНА МИХАЙЛОВНА;7716 214721;355192077 81;пороки развития у детей, наследственные заболевания, планирование беременности;Генетик;2024-07-08T20:30;общий анализ крови, генетический анализ;2024-07-09T09:35;12850;5389 9444 8638 6455
ЛЕБЕДЕВА ЛЮБОВЬ ВИКТОРОВНА;4710 577029;413364392 57;кровотечение, боль в животе;Хирург;2024-06-12T18:10;биохимический анализ крови;2024-06-13T12:10;850;5112 2379 1946 7512
КОЗЛОВА МАРИЯ ИВАНОВНА;5920 158738;791870328 44;длительная лихорадка, хрипы;Пульмонолог;2024-04-22T13:00;общий анализ крови, спирометрия;2024-04-24T10:55;2650;2200 5690 5226 9361
БАРАНОВА СВЕТЛАНА МИХАЙЛОВНА;4525 604403;260802501 37;кашель, потеря аппетита, сыпь;Педиатр;2024-03-05T18:55;общий анализ мочи, общий анализ крови;2024-03-06T10:00;1140;4377 7386 9183 3068
ГУСЕВА НИНА ИГОРЕВНА;4522 922872;901752953 01;отеки, боли в пояснице, изменение цвета мочи;Нефролог;2024-07-07T16:10;общий анализ мочи, биохимический анализ крови;2024-07-09T10:00;1140;2200 5650 2140 1286
АЛЕКСЕЕВА РАИСА НИКОЛАЕВНА;5911 277283;852744701 24;одышка, головная боль, повышение температуры, слабость;Терапевт;2024-02-16T09:05;биохимический анализ крови, общий анализ крови;2024-02-19T10:05;1700;5112 2374 3399 9599
КОЗЛОВ ВЛАДИМИР АЛЕКСАНДРОВИЧ;4517 568972;265994667 51;покраснение глаз, ощущение песка;Офтальмолог;2024-05-03T21:35;офтальмоскопия, томография глаза;2024-05-05T09:35;1000;2200 7022 5359 1757
ЖУРАВЛЕВ ВИКТОР МИХАЙЛОВИЧ;4522 752837;501523175 25;необходимость удаления зуба, отек;Стоматолог-хирург;2024-04-05T21:35;общий анализ крови;2024-04-07T12:00;850;4377 7313 5244 7572
ЖУРАВЛЕВ ВИКТОР МИХАЙЛОВИЧ;4522 752837;501523175 25;боль после травмы, нарушение движений, боль в суставах, отеки;Травматолог-ортопед;2024-08-10T11:15;рентген сустава, общий анализ крови, МРТ сустава;2024-08-11T10:15;8850;4039 3337 1954 7752
ЕГОРОВА ЛАРИСА РОМАНОВНА;4517 844046;783709662 56;слабость, кашель, головная боль;Терапевт;2024-07-10T19:25;общий анализ мочи, общий анализ крови, рентген грудной клетки;2024-07-13T12:00;2340;2200 7059 5465 2687
ЖУКОВА ВАЛЕРИЯ ИЛЬИНИЧНА;6609 165958;750804713 92;потеря аппетита, сыпь, лихорадка;Педиатр;2024-12-25T16:50;общий анализ крови;2024-12-27T10:25;850;5211 9439 7816 9556
ВОРОБЬЕВ МИХАИЛ МИХАЙЛОВИЧ;4713 448817;980144821 14;слабость, похудение, потливость, жажда;Эндокринолог;2024-10-24T12:30;анализ на гормоны щитовидной железы;2024-10-26T12:35;1500;5211 9479 7267 2711
МАКАРОВ ДМИТРИЙ ВЯЧЕСЛАВОВИЧ;5025 453893;690862639 43;насморк;Педиатр;2024-08-06T12:25;общий анализ крови, общий анализ мочи;2024-08-08T10:20;1140;2200 5615 3644 8928
АБРАМОВ ВЛАДИМИР ВИКТОРОВИЧ;4520 432312;921618856 15;кашель, одышка, слабость, головная боль, повышение температуры;Терапевт;2024-05-08T13:45;общий анализ мочи, биохимический анализ крови, общий анализ крови;2024-05-10T09:00;1990;4377 7361 5226 4578
СЕМЕНОВ ВЯЧЕСЛАВ АЛЕКСЕЕВИЧ;5915 592322;477679257 69;кровотечение, высокая температура, припухлость, боль в животе;Хирург;2024-01-24T16:35;общий анализ крови, коагулограмма;2024-01-26T11:00;1650;5211 9435 7854 6394
АЛЕКСЕЕВА ЕКАТЕРИНА СТАНИСЛАВОВНА;5925 967359;650441387 73;тошнота;Гастроэнтеролог;2024-06-02T12:45;УЗИ органов брюшной полости;2024-06-03T11:45;2500;4039 3367 4681 5693
ГУСЕВА ВАЛЕНТИНА ВАСИЛЬЕВНА;6620 319049;661767534 32;боль в горле, снижение слуха, головокружение, заложенность носа;Оториноларинголог (ЛОР);2024-03-01T12:30;мазок из зева;2024-03-04T12:55;800;2202 2060 2467 8028
ТАРАСОВА ТАТЬЯНА ВАСИЛЬЕВНА;6618 532136;023534993 45;расшифровка ЭЭГ;Врач функциональной диагностики;2024-10-26T14:50;ЭЭГ;2024-10-28T11:25;1800;2200 5689 9703 1363
КОЗЛОВ ВЛАДИМИР АЛЕКСАНДРОВИЧ;4517 568972;265994667 51;припухлость, боль в животе, высокая температура, кровотечение;Хирург;2024-06-28T20:10;коагулограмма, общий анализ крови;2024-06-30T11:10;1650;5112 2388 4219 3674
ЕГОРОВ ИГОРЬ ВИКТОРОВИЧ;4709 609255;585865725 70;боль в животе;Хирург;2024-08-19T10:05;биохимический анализ крови;2024-08-21T12:50;850;2202 2071 4984 6392
МОРОЗОВА ЛАРИСА АЛЕКСАНДРОВНА;7708 317134;658418853 46;высокая температура, припухлость, боль в животе, кровотечение;Хирург;2024-07-10T10:55;общий анализ крови;2024-07-12T09:00;850;5228 6054 8444 3472
ЕГОРОВА ДАРЬЯ ДМИТРИЕВНА;7810 880475;081637155 67;потеря аппетита, кашель;Педиатр;2024-08-30T14:30;мазок из носа/горла, биохимический анализ крови;2024-09-01T10:35;1750;2200 5649 3828 7391
ЛЕБЕДЕВА МАРИНА ИГОРЕВНА;5012 137200;111856149 40;кровотечение, припухлость, боль в животе, высокая температура;Хирург;2024-11-20T13:30;УЗИ органов брюшной полости, коагулограмма, биохимический анализ крови, общий анализ крови;2024-11-22T10:30;5000;5112 2382 8569 7436
ВОЛКОВА НАТАЛЬЯ ВАЛЕРЬЕВНА;5024 277123;492418456 09;изжога, вздутие, тошнота, рвота, запор, диарея;Гастроэнтеролог;2024-03-25T12:20;ФГДС, биохимический анализ крови, общий анализ крови, УЗИ органов брюшной полости;2024-03-28T12:00;9700;5389 9432 1260 7653
НИКОЛАЕВ АНАТОЛИЙ СЕРГЕЕВИЧ;7813 225685;164746083 89;слабость, головная боль;Терапевт;2024-06-04T20:05;рентген грудной клетки, биохимический анализ крови, общий анализ мочи, общий анализ крови;2024-06-06T11:05;3190;5112 2395 3390 7629
БАРАНОВА НАТАЛИЯ СЕРГЕЕВНА;5912 649860;933740473 15;кашель, сыпь, потеря аппетита, лихорадка, насморк;Педиатр;2024-11-04T18:55;биохимический анализ крови, мазок из носа/горла, общий анализ крови, общий анализ мочи;2024-11-07T10:15;2890;5112 2392 7253 6275
АЛЕКСЕЕВА АЛЕКСАНДРА СЕРГЕЕВНА;5009 327381;693930184 37;слабость;Фтизиатр;2024-05-17T19:25;рентген грудной клетки, общий анализ крови;2024-05-20T09:25;2050;5112 2371 2355 3889
СМИРНОВ ДМИТРИЙ ВЛАДИМИРОВИЧ;6624 192537;891213084 99;одышка, слабость, головная боль, кашель, повышение температуры;Терапевт;2024-04-29T19:20;рентген грудной клетки, биохимический анализ крови, общий анализ крови, общий анализ мочи;2024-04-30T10:50;3190;5228 6091 7885 1876
ПАВЛОВА ТАМАРА СТЕПАНОВНА;5917 122491;849919245 79;спазмы мышц;Мануальный терапевт;2024-03-05T13:10;общий анализ крови;2024-03-07T12:00;850;4039 3324 2364 6273
АЛЕКСЕЕВ АНДРЕЙ ВАЛЕНТИНОВИЧ;4720 135075;616841937 14;утренняя скованность, припухлость, боль в суставах;Ревматолог;2024-11-26T14:25;ревматоидный фактор, общий анализ крови;2024-11-29T10:25;1750;4306 4383 5989 6906
МОРОЗОВ АЛЕКСЕЙ БОРИСОВИЧ;7813 616590;351567059 80;частое мочеиспускание, слабость, похудение, набор веса, жажда;Эндокринолог;2024-02-08T15:20;ТТГ;2024-02-11T10:50;410;4377 7383 1644 2813
КИСЕЛЕВ СЕРГЕЙ НИКОЛАЕВИЧ;6617 214527;614209715 65;жажда, набор веса, слабость;Эндокринолог;2024-07-17T14:55;ТТГ, глюкоза крови;2024-07-20T12:55;670;2200 4028 3162 1474
ЕГОРОВ АЛЕКСАНДР АНДРЕЕВИЧ;5024 882533;432614472 58;одышка, слабость;Терапевт;2024-05-14T19:25;общий анализ мочи, биохимический анализ крови, общий анализ крови;2024-05-16T10:40;1990;5112 2392 1410 3974
СИДОРОВ ВИКТОР ВАДИМОВИЧ;7713 249751;161595398 93;боли в пояснице, отеки, изменение цвета мочи, повышенное давление;Нефролог;2024-03-07T11:50;общий анализ мочи;2024-03-09T12:25;290;5112 2355 5090 9152
МОРОЗОВА ВАЛЕРИЯ ВАЛЕРЬЕВНА;4725 308608;565430653 97;припухлость, кровотечение, боль в животе, высокая температура;Хирург;2024-03-03T13:35;общий анализ крови, УЗИ органов брюшной полости, коагулограмма;2024-03-05T10:10;4150;2200 5647 9717 3313
ПОЛЯКОВ ДМИТРИЙ АЛЕКСАНДРОВИЧ;5017 948402;968759361 07;перепады настроения, панические атаки;Психиатр;2024-10-11T10:35;психодиагностика;2024-10-13T12:15;5000;4377 7341 8668 9404
КИСЕЛЕВ СЕРГЕЙ НИКОЛАЕВИЧ;6617 214527;614209715 65;заложенность носа;Оториноларинголог (ЛОР);2024-05-29T13:30;мазок из зева, аудиометрия;2024-05-30T09:45;2000;2200 5638 2913 8591
БОРИСОВА ГАЛИНА ВИКТОРОВНА;5009 847246;798332344 51;заложенность носа, боль в горле, головокружение, снижение слуха;Оториноларинголог (ЛОР);2024-10-06T15:50;мазок из зева;2024-10-08T09:15;800;5112 2356 9748 9067
СЕРГЕЕВА ПОЛИНА СТЕПАНОВНА;4010 742649;312346233 25;родинки;Онколог;2024-02-18T09:15;общий анализ крови, биохимический анализ крови, онкомаркеры;2024-02-20T11:15;4100;4377 7328 2767 1849
СМИРНОВА НАДЕЖДА ЛЬВОВНА;5913 575864;282702518 70;сыпь, потеря аппетита, насморк, кашель, лихорадка;Педиатр;2024-11-30T11:00;биохимический анализ крови, общий анализ крови, общий анализ мочи;2024-12-01T12:00;1990;4306 4375 9424 4294
ЖУРАВЛЕВА НИНА ЕВГЕНЬЕВНА;5907 568227;254729046 87;головная боль, повышение температуры;Терапевт;2024-10-10T19:00;общий анализ мочи, общий анализ крови, рентген грудной клетки, биохимический анализ крови;2024-10-12T11:15;3190;2200 4053 8524 9512
КОРОЛЕВА АННА НИКОЛАЕВНА;5911 624828;184821754 97;кровотечение, припухлость, высокая температура, боль в животе;Хирург;2024-04-06T18:20;общий анализ крови, УЗИ органов брюшной полости, биохимический анализ крови, коагулограмма;2024-04-09T10:15;5000;2200 5694 4509 6290
ФРОЛОВ АЛЕКСАНДР АЛЕКСАНДРОВИЧ;5919 241607;614741165 75;сердечно-сосудистые заболевания;Кардиолог-геронтолог;2024-07-27T14:40;общий анализ крови, ЭКГ;2024-07-29T10:25;2350;4306 4332 4555 9496
АНТОНОВА ЛЮДМИЛА АЛЕКСЕЕВНА;7810 785414;700343330 27;набор веса, потливость;Эндокринолог;2024-10-04T12:35;анализ на гормоны щитовидной железы, ТТГ, глюкоза крови;2024-10-07T10:40;2170;5112 2342 5360 6915
ЗАХАРОВ АЛЕКСАНДР СЕМЕНОВИЧ;5917 566259;457363061 97;лихорадка, потеря аппетита, насморк;Педиатр;2024-09-16T14:35;общий анализ крови, общий анализ мочи, мазок из носа/горла, биохимический анализ крови;2024-09-17T12:20;2890;5389 9460 1348 8373
КОРОЛЕВА ГАЛИНА ИВАНОВНА;4507 639645;685135479 27;частое мочеиспускание, слабость;Эндокринолог;2024-09-27T18:05;ТТГ;2024-09-30T09:35;410;4377 7396 2514 2110
ФЕДОРОВ НИКОЛАЙ ВЛАДИМИРОВИЧ;4017 651020;847418118 25;бесплодие, нарушения эрекции, низкое либидо, боль в яичках;Андролог;2024-09-20T15:45;спермограмма;2024-09-21T10:25;1200;4306 4335 9549 2161
