СИДОРОВА НАТАЛЬЯ ДМИТРИЕВНА;4713 502893;881230275 94;деформации, нарушение движений, боль в суставах, отеки;Травматолог-ортопед;2024-03-07T20:35;рентген сустава, МРТ сустава, общий анализ крови;2024-03-09T09:35;8850;4039 3376 8364 5447
КИСЕЛЕВ ВИКТОР ВАСИЛЬЕВИЧ;4022 622860;303591273 49;кровь в стуле, запоры, зуд, боль в заднем проходе;Проктолог;2024-02-27T12:25;анализ кала на скрытую кровь, общий анализ крови;2024-03-01T11:25;1450;2200 4056 9911 1089
АЛЕКСЕЕВ ВЛАДИМИР АЛЕКСЕЕВИЧ;5908 468083;141064709 23;судороги, приступы потери сознания, подбор терапии при эпилепсии;Эпилептолог;2024-02-26T10:50;общий анализ крови, МРТ головного мозга;2024-02-28T10:00;8350;2200 5655 9050 4565
ИВАНОВ СЕРГЕЙ СЕРГЕЕВИЧ;6619 164957;858564872 82;недостаток веса, лишний вес, нарушения пищеварения;Диетолог;2024-12-29T09:05;биохимический анализ крови;2024-12-31T11:55;850;2200 5613 8841 5679
ИВАНОВ АЛЕКСЕЙ АЛЕКСАНДРОВИЧ;4507 510298;985165053 47;слабость, кашель, головная боль;Терапевт;2024-01-09T19:30;общий анализ мочи;2024-01-12T09:50;290;5112 2316 9366 1099
МОРОЗОВ СТАНИСЛАВ АЛЕКСЕЕВИЧ;4716 582753;595190523 23;кровотечение, припухлость, боль в животе;Хирург;2024-02-23T14:50;биохимический анализ крови, коагулограмма, УЗИ органов брюшной полости;2024-02-25T11:50;4150;4377 7335 6534 3164
КИСЕЛЕВА АНАСТАСИЯ ВИТАЛЬЕВНА;5011 993448;371539966 14;сыпь, лихорадка, насморк, кашель;Педиатр;2024-04-22T21:05;общий анализ мочи, общий анализ крови;2024-04-24T11:45;1140;5389 9469 1300 6272
ФРОЛОВА ТАТЬЯНА ВЛАДИСЛАВОВНА;5019 900862;650116020 32;нарушения менструации, зуд;Гинеколог;2024-08-08T09:50;УЗИ органов малого таза, общий анализ крови, мазок на флору;2024-08-10T11:25;3950;2200 5642 7969 3457
РОМАНОВА НАТАЛЬЯ АНДРЕЕВНА;7821 401460;031013202 56;зуд, выделения, нарушения менструации, боли внизу живота;Гинеколог;2024-01-21T17:05;УЗИ органов малого таза, мазок на флору, общий анализ крови;2024-01-23T09:25;3950;4306 4326 4590 4477
КОЗЛОВ СЕРГЕЙ МИХАЙЛОВИЧ;7823 279048;947881643 81;недостаток веса, лишний вес, нарушения пищеварения, пищевая непереносимость;Диетолог;2024-08-30T13:35;биохимический анализ крови;2024-09-02T11:35;850;2202 2082 3191 7401
НИКИТИНА НАТАЛЬЯ НИКОЛАЕВНА;5017 395478;522402295 35;повышение температуры, головная боль, слабость, кашель, одышка;Терапевт;2024-04-07T18:15;общий анализ мочи;2024-04-10T11:20;290;2200 5617 6820 5298
БАРАНОВА ТАТЬЯНА АНАТОЛЬЕВНА;5918 556942;469519538 45;перхоть, заболевания кожи головы, облысение;Трихолог;2024-07-05T10:55;соскоб кожи;2024-07-06T12:40;700;4039 3331 9382 4451
СМИРНОВА МАРИНА ВИКТОРОВНА;4714 498109;496218137 13;слезотечение, кожная сыпь, отек;Аллерголог-иммунолог;2024-05-25T11:00;общий анализ крови;2024-05-27T09:05;850;2200 4088 2776 2029
МАКАРОВ ДАНИЛА КОНСТАНТИНОВИЧ;7708 305501;987900113 54;слезотечение;Офтальмолог;2024-01-01T09:40;офтальмоскопия;2024-01-02T09:40;600;2200 7025 7320 4640
ЖУРАВЛЕВА НИНА ЕВГЕНЬЕВНА;5907 568227;254729046 87;боль при мочеиспускании, боль в пояснице;Уролог;2024-08-16T17:10;УЗИ почек и мочевого пузыря, общий анализ мочи;2024-08-19T11:20;2790;2200 5675 2578 4332
ЛЕБЕДЕВА ЛЮДМИЛА ГРИГОРЬЕВНА;4716 251418;362972875 27;составление программ восстановительной гимнастики;Врач ЛФК;2024-12-09T16:05;индивидуальное занятие ЛФК (30 минут);2024-12-10T11:25;2600;4039 3395 6592 2430
АНТОНОВА СВЕТЛАНА ИВАНОВНА;7721 449035;669267464 61;боль в суставах;Ревматолог;2024-06-12T15:15;ревматоидный фактор;2024-06-15T09:15;900;5112 2394 6302 2840
НОВИКОВ ЕВГЕНИЙ ДМИТРИЕВИЧ;4724 753903;239402924 71;насморк, кашель;Педиатр;2024-12-28T12:10;мазок из носа/горла, общий анализ крови;2024-12-30T11:30;1750;5112 2311 3986 2754
АНДРЕЕВА ЕЛЕНА ВИТАЛЬЕВНА;7714 391744;469686314 60;необходимость удаления зуба, зубная боль, отек, воспаление десен;Стоматолог-хирург;2024-10-29T21:00;рентген зубов, биохимический анализ крови, общий анализ крови;2024-11-01T12:00;2400;5211 9415 7232 1181
МИХАЙЛОВА ЛЮБОВЬ АЛЕКСАНДРОВНА;7823 204977;338930250 91;сыпь;Дерматолог;2024-06-01T20:30;соскоб кожи на грибки;2024-06-03T10:10;700;5211 9475 6836 9343
ИВАНОВ ЯРОСЛАВ ВИКТОРОВИЧ;7721 983404;649186288 47;головная боль;Терапевт;2024-12-22T12:45;общий анализ крови;2024-12-24T11:10;850;5112 2311 3131 7786
НИКИТИН МИХАИЛ РОМАНОВИЧ;4707 340339;039306391 56;лихорадка, насморк, кашель, сыпь;Педиатр;2024-08-06T21:10;общий анализ мочи, биохимический анализ крови, мазок из носа/горла, общий анализ крови;2024-08-09T09:50;2890;5112 2338 9533 4844
ПАВЛОВ АНДРЕЙ ОЛЕГОВИЧ;7715 330164;806974999 71;нарушения менструации, выделения, зуд;Гинеколог;2024-11-26T17:45;мазок на флору;2024-11-29T10:45;800;4306 4347 6305 2273
ИВАНОВА ЕЛЕНА ВИКТОРОВНА;5012 770166;772533167 10;составление программ восстановительной гимнастики;Врач ЛФК;2024-08-08T09:50;индивидуальное занятие ЛФК (30 минут);2024-08-09T12:50;2600;4306 4391 7573 7542
СМИРНОВ АЛЕКСАНДР ВЛАДИМИРОВИЧ;6616 985939;597897471 11;кашель, лихорадка, насморк, потеря аппетита;Педиатр;2024-10-15T12:50;мазок из носа/горла, общий анализ крови, биохимический анализ крови;2024-10-17T12:50;2600;4039 3310 5949 2147
ВОРОБЬЕВ СЕРГЕЙ АЛЕКСАНДРОВИЧ;7814 174843;753139384 08;лихорадка, сыпь, насморк, потеря аппетита;Педиатр;2024-04-13T10:35;общий анализ мочи;2024-04-15T12:55;290;5112 2389 7901 8965
СОКОЛОВА ГАЛИНА ИВАНОВНА;4716 442083;474794723 49;одышка, головная боль, кашель, повышение температуры, слабость;Терапевт;2024-05-19T09:15;общий анализ мочи;2024-05-21T12:40;290;2200 4045 3929 5020
ИВАНОВ ОЛЕГ ВИТАЛЬЕВИЧ;6618 181800;738472457 37;стресс, нарушения сна, тревога, депрессия, проблемы в отношениях;Психотерапевт;2024-10-18T21:55;психодиагностика, общий анализ крови;2024-10-21T10:20;5850;2200 5674 7277 3480
КИСЕЛЕВА ЕКАТЕРИНА ИВАНОВНА;7721 137765;761488744 45;утренняя скованность, слабость, боль в суставах, припухлость;Ревматолог;2024-09-05T20:40;ревматоидный фактор, общий анализ крови;2024-09-07T12:40;1750;4306 4352 1567 9995
ФЕДОРОВ НИКОЛАЙ ВЛАДИМИРОВИЧ;4017 651020;847418118 25;лихорадка, насморк, потеря аппетита, сыпь;Педиатр;2024-05-20T14:20;мазок из носа/горла, общий анализ крови;2024-05-23T09:50;1750;4039 3386 5117 1186
МИХАЙЛОВА ГАЛИНА ПАВЛОВНА;4710 739554;544448835 14;слабость, одышка;Пульмонолог;2024-01-14T11:35;рентген грудной клетки;2024-01-15T12:20;1200;4306 4332 8714 4614
НИКОЛАЕВ ДМИТРИЙ СЕРГЕЕВИЧ;5908 394050;342194008 47;воспаление десен, зубная боль;Стоматолог-хирург;2024-10-27T12:20;биохимический анализ крови, рентген зубов, общий анализ крови;2024-10-28T11:00;2400;4377 7382 5087 5630
СОКОЛОВА ВЕРА СЕМЕНОВНА;4011 101962;287056748 15;боль после травмы, нарушение движений;Травматолог-ортопед;2024-08-26T13:20;рентген сустава, МРТ сустава;2024-08-29T11:40;8000;4306 4332 8821 4595
СМИРНОВА НАДЕЖДА НИКОЛАЕВНА;5908 166505;924289906 44;одышка, кашель, повышение температуры, головная боль;Терапевт;2024-01-04T12:05;рентген грудной клетки, биохимический анализ крови;2024-01-05T10:50;2050;4039 3335 8475 3390
ИВАНОВА АЛЕКСАНДРА ВИКТОРОВНА;5913 968051;906163305 84;кашель, слабость, одышка, головная боль;Терапевт;2024-06-14T12:15;общий анализ мочи, рентген грудной клетки;2024-06-17T11:05;1490;2200 5655 4207 9493
НОВИКОВА ИРИНА НИКОЛАЕВНА;4010 225106;085605857 95;ограничение движений, боли в спине, спазмы мышц;Мануальный терапевт;2024-05-29T21:15;МРТ позвоночника;2024-06-01T11:10;6500;2200 5688 5812 4272
НИКОЛАЕВА НАТАЛЬЯ АЛЕКСАНДРОВНА;5910 670834;434670565 90;слабость, синяки, кровотечения;Гематолог;2024-08-08T12:05;коагулограмма, общий анализ крови;2024-08-10T12:10;1650;4306 4397 4991 8322
КОРОЛЕВА АННА АНАТОЛЬЕВНА;4517 314919;188920057 08;возрастные изменения кожи;Косметолог;2024-01-15T20:30;общий анализ крови;2024-01-18T10:40;850;4986 2990 1885 1852
ИВАНОВА НАТАЛЬЯ ГРИГОРЬЕВНА;4515 337929;305329733 55;повышение температуры;Терапевт;2024-10-01T16:35;биохимический анализ крови, общий анализ мочи;2024-10-02T12:10;1140;2202 2017 1791 9602
МАКСИМОВА ЮЛИЯ ЕВГЕНЬЕВНА;5916 505552;658894012 61;похудение;Эндокринолог;2024-06-28T20:05;глюкоза крови;2024-07-01T09:45;260;2200 5616 9328 4821
БЕЛОВА ЮЛИЯ БОРИСОВНА;4512 150747;185420365 67;кашель, потеря аппетита, насморк, лихорадка;Педиатр;2024-04-26T16:40;биохимический анализ крови, мазок из носа/горла, общий анализ мочи, общий анализ крови;2024-04-28T10:25;2890;4306 4392 8999 5646
СМИРНОВ ДМИТРИЙ НИКОЛАЕВИЧ;7710 870113;403592223 52;родинки;Онколог;2024-09-24T15:00;онкомаркеры, общий анализ крови, биохимический анализ крови;2024-09-27T12:55;4100;5211 9475 3233 6505
АНТОНОВА НАДЕЖДА ДМИТРИЕВНА;5912 451424;839100960 02;зуд;Гинеколог;2024-08-12T09:10;УЗИ органов малого таза, мазок на флору, общий анализ крови;2024-08-14T11:35;3950;5389 9431 3132 6479
ЗАЙЦЕВ ПАВЕЛ МИХАЙЛОВИЧ;5011 137628;999200556 57;сыпь, лихорадка, потеря аппетита, насморк;Педиатр;2024-08-27T17:50;общий анализ мочи, мазок из носа/горла, общий анализ крови;2024-08-29T12:50;2040;2200 7084 5150 8832
МИХАЙЛОВ АНДРЕЙ ИЛЬИЧ;7819 175195;768080326 24;пороки развития у детей, наследственные заболевания, планирование беременности;Генетик;2024-06-01T09:55;генетический анализ, общий анализ крови;2024-06-03T11:45;12850;5228 6076 5842 1416
СТЕПАНОВА ВИКТОРИЯ ВЯЧЕСЛАВОВНА;7808 228737;048700330 44;кашель, повышение температуры, слабость, головная боль;Терапевт;2024-06-13T12:40;общий анализ мочи;2024-06-15T11:00;290;4377 7361 9334 3140
ВОЛКОВ АРТЕМ ФЕДОРОВИЧ;5024 836884;466945547 48;диарея, вздутие, изжога, рвота, тошнота, боль в животе, запор;Гастроэнтеролог;2024-04-17T18:45;биохимический анализ крови, ФГДС, УЗИ органов брюшной полости, общий анализ крови;2024-04-19T11:25;9700;5228 6035 6038 6049
НИКОЛАЕВ АНАТОЛИЙ СЕРГЕЕВИЧ;7813 225685;164746083 89;сердечно-сосудистые заболевания, сердечно-сосудистые заболевания у пациентов старшего возраста;Кардиолог-геронтолог;2024-07-12T21:30;ЭКГ, общий анализ крови;2024-07-15T11:30;2350;2200 7083 6505 5141
ИВАНОВА ДАРЬЯ АЛЕКСЕЕВНА;4515 860375;585322807 09;панические атаки;Психиатр;2024-10-28T18:25;общий анализ крови, психодиагностика;2024-10-30T10:25;5850;5389 9448 3449 4157
РОМАНОВА АННА ПЕТРОВНА;4525 331400;269955925 62;головная боль;Терапевт;2024-02-20T18:30;биохимический анализ крови, общий анализ крови, общий анализ мочи, рентген грудной клетки;2024-02-23T11:30;3190;2200 5643 7222 7304
МАКАРОВ НИКОЛАЙ СЕРГЕЕВИЧ;5912 836271;272446308 72;слабость, одышка, головная боль, повышение температуры;Терапевт;2024-09-28T11:15;общий анализ мочи;2024-10-01T10:55;290;2200 7025 2357 8418
НИКОЛАЕВ ДМИТРИЙ СЕРГЕЕВИЧ;5908 394050;342194008 47;боли в спине;Мануальный терапевт;2024-06-12T21:00;общий анализ крови, МРТ позвоночника;2024-06-15T11:00;7350;5112 2317 9464 3917
ЕГОРОВ БОРИС ОЛЕГОВИЧ;5925 316052;828957444 73;повышение температуры, кашель;Терапевт;2024-10-07T12:50;общий анализ мочи, общий анализ крови, рентген грудной клетки, биохимический анализ крови;2024-10-10T12:50;3190;5112 2395 7879 5219
АНТОНОВА ЛЮДМИЛА АЛЕКСЕЕВНА;7810 785414;700343330 27;заложенность носа, боль в горле, головокружение;Оториноларинголог (ЛОР);2024-10-28T17:35;мазок из зева;2024-10-29T12:30;800;4377 7332 2155 4373
СМИРНОВ АЛЕКСЕЙ ВЛАДИМИРОВИЧ;4011 749746;450341129 33;необычные уплотнения;Онколог;2024-10-10T11:25;общий анализ крови;2024-10-13T11:15;850;5211 9448 4082 9040
ЛЕБЕДЕВ ДМИТРИЙ АЛЕКСЕЕВИЧ;7723 983418;362714437 76;кровотечение, боль в животе, высокая температура;Хирург;2024-06-11T18:40;УЗИ органов брюшной полости;2024-06-13T10:05;2500;2202 2094 6396 2547
АБРАМОВ ВЛАДИМИР ВИКТОРОВИЧ;4520 432312;921618856 15;лихорадка, кашель, сыпь;Инфекционист;2024-09-05T21:35;общий анализ крови, мазок на инфекции, серологические анализы;2024-09-07T11:20;2950;5389 9466 7756 5399
ТАРАСОВ АЛЕКСАНДР ВАСИЛЬЕВИЧ;6609 989312;522165605 53;отеки, боль в суставах, деформации, боль после травмы, нарушение движений;Травматолог-ортопед;2024-04-07T09:05;общий анализ крови;2024-04-09T11:15;850;5211 9483 9801 9401
МАКСИМОВА ЕЛЕНА АЛЕКСАНДРОВНА;4516 460655;011276811 12;боль в животе, высокая температура;Хирург;2024-08-16T19:40;биохимический анализ крови, коагулограмма, общий анализ крови, УЗИ органов брюшной полости;2024-08-19T09:35;5000;2200 5656 6079 7117
СОЛОВЬЕВА НИНА ЮРЬЕВНА;7711 478994;321141720 04;ухудшение зрения, ощущение песка, покраснение глаз, слезотечение, боль;Офтальмолог;2024-05-26T12:05;офтальмоскопия;2024-05-29T09:05;600;4377 7335 6313 6729
АЛЕКСЕЕВ ЮРИЙ БОРИСОВИЧ;7716 759434;779628536 85;головная боль;Невролог;2024-07-25T09:05;общий анализ крови, МРТ головного мозга, биохимический анализ крови;2024-07-27T12:00;9200;2202 2098 7541 3975
МИХАЙЛОВ НИКОЛАЙ АЛЕКСАНДРОВИЧ;4515 596396;929361296 40;кровоточивость десен, зубная боль, чувствительность зубов;Стоматолог;2024-10-20T13:35;рентген зубов, общий анализ крови;2024-10-22T09:55;1550;5211 9488 2864 4825
ЗАЙЦЕВ АНДРЕЙ СЕМЕНОВИЧ;4023 630210;085483854 11;высокая температура, припухлость;Хирург;2024-03-10T10:20;коагулограмма, общий анализ крови, УЗИ органов брюшной полости, биохимический анализ крови;2024-03-13T09:10;5000;5228 6042 6256 9636
АЛЕКСЕЕВА ЛЮБОВЬ ИВАНОВНА;4512 455828;494549408 40;боль в пояснице;Уролог;2024-09-08T17:15;общий анализ мочи, бактериологический посев мочи;2024-09-11T12:00;1190;4039 3381 8104 1375
ФЕДОРОВ АЛЕКСАНДР АНДРЕЕВИЧ;6609 940080;092541243 56;покраснение глаз, ухудшение зрения, боль;Офтальмолог;2024-01-18T21:30;офтальмоскопия;2024-01-19T12:45;600;4377 7347 1692 4626
ФЕДОРОВ АНДРЕЙ МИХАЙЛОВИЧ;5916 960240;332765990 00;слабость, одышка, кашель;Терапевт;2024-10-05T18:05;рентген грудной клетки, биохимический анализ крови, общий анализ мочи;2024-10-07T09:10;2340;2200 5691 7159 2351
ИВАНОВ СЕРГЕЙ ВЛАДИМИРОВИЧ;7820 712201;651855784 33;слабость, головная боль;Терапевт;2024-01-19T13:25;биохимический анализ крови, общий анализ мочи, рентген грудной клетки;2024-01-21T12:30;2340;5389 9457 1477 3215
МИХАЙЛОВ РОМАН АЛЕКСЕЕВИЧ;7808 613772;240880404 53;повышение температуры, кашель, одышка, головная боль, слабость;Терапевт;2024-08-21T19:00;биохимический анализ крови, рентген грудной клетки, общий анализ крови, общий анализ мочи;2024-08-24T12:05;3190;2200 5667 6776 7169
КОЗЛОВА КРИСТИНА ВЛАДИМИРОВНА;5007 934717;765427941 42;снижение веса, необычные уплотнения, длительные боли;Онколог;2024-01-27T14:55;онкомаркеры;2024-01-29T10:55;2400;4306 4336 3845 9284
ЖУКОВА ЛЮБОВЬ СЕРГЕЕВНА;7810 826972;528203661 71;шелушение, зуд;Дерматолог;2024-08-23T15:30;соскоб кожи на грибки;2024-08-25T10:30;700;5389 9470 5584 2503
КУЗЬМИН ДЕНИС НИКОЛАЕВИЧ;4507 974191;179393087 24;слабость;Терапевт;2024-01-30T18:40;рентген грудной клетки;2024-02-02T12:35;1200;4306 4317 2168 4882
АНДРЕЕВ ВИКТОР АНДРЕЕВИЧ;7815 592719;081941685 87;высокая температура, припухлость, кровотечение;Хирург;2024-10-28T17:45;биохимический анализ крови, УЗИ органов брюшной полости;2024-10-30T10:50;3350;2202 2095 6942 5172
ФЕДОРОВ АЛЕКСАНДР АНДРЕЕВИЧ;6609 940080;092541243 56;боль в животе;Хирург;2024-03-30T09:40;УЗИ органов брюшной полости, биохимический анализ крови, коагулограмма;2024-04-01T09:05;4150;4986 2936 2140 1709
ЕГОРОВА ЕЛЕНА АНАТОЛЬЕВНА;5908 692201;312875565 83;одышка, повышение температуры, кашель, слабость, головная боль;Терапевт;2024-01-05T11:10;общий анализ крови, рентген грудной клетки, общий анализ мочи;2024-01-08T10:50;2340;4039 3390 3562 3895
ВАСИЛЬЕВ ВАДИМ АНАТОЛЬЕВИЧ;4712 415588;408318312 59;боль в суставах, деформации, нарушение движений;Травматолог-ортопед;2024-11-30T10:40;общий анализ крови, рентген сустава;2024-12-02T11:50;2350;5389 9461 2918 5000
КОЗЛОВА АННА ВАСИЛЬЕВНА;4724 549925;066048080 57;насморк, кашель, потеря аппетита, сыпь;Педиатр;2024-03-05T15:00;мазок из носа/горла, биохимический анализ крови;2024-03-07T09:00;1750;5112 2364 9845 8373
НИКИТИНА ЛЮБОВЬ АЛЕКСАНДРОВНА;4720 359373;601951019 54;головная боль, повышение температуры, слабость;Терапевт;2024-03-30T16:10;рентген грудной клетки, биохимический анализ крови, общий анализ крови, общий анализ мочи;2024-04-01T10:10;3190;4039 3314 4406 1562
БОРИСОВ МИХАИЛ НИКОЛАЕВИЧ;5010 835177;441453900 62;стресс, проблемы в отношениях, тревога;Психотерапевт;2024-01-16T09:50;психодиагностика;2024-01-17T11:20;5000;5112 2311 8152 6253
СМИРНОВА НАДЕЖДА НИКОЛАЕВНА;5908 166505;924289906 44;припухлость, высокая температура, кровотечение, боль в животе;Хирург;2024-02-14T17:55;биохимический анализ крови, общий анализ крови, УЗИ органов брюшной полости, коагулограмма;2024-02-17T10:50;5000;5112 2392 5234 2176
АЛЕКСЕЕВ АЛЕКСАНДР СЕРГЕЕВИЧ;5022 535406;556246375 09;лихорадка, сыпь, насморк, потеря аппетита, кашель;Педиатр;2024-12-04T15:40;общий анализ крови, мазок из носа/горла, биохимический анализ крови;2024-12-05T10:35;2600;5112 2344 9838 3442
БОРИСОВ ПЕТР ЕВГЕНЬЕВИЧ;5020 309869;781498718 64;боль при мочеиспускании;Уролог;2024-08-13T16:40;УЗИ почек и мочевого пузыря, общий анализ мочи;2024-08-16T11:00;2790;5112 2398 2098 2449
ГУСЕВА ОЛЬГА ВЛАДИМИРОВНА;5919 152511;161516948 65;зуд, кровь в стуле, запоры, боль в заднем проходе;Проктолог;2024-02-01T20:20;анализ кала на скрытую кровь, общий анализ крови;2024-02-04T12:15;1450;5112 2378 8280 6818
АЛЕКСЕЕВА ОЛЬГА КУЗЬМИНИЧНА;5913 145043;457944178 38;лихорадка, слабость, кашель, сыпь;Инфекционист;2024-12-11T13:30;мазок на инфекции;2024-12-13T09:30;900;5389 9476 8710 3701
СЕМЕНОВА АННА АНДРЕЕВНА;6608 537424;564750164 05;слабость, одышка, повышение температуры, головная боль;Терапевт;2024-03-22T13:35;биохимический анализ крови, общий анализ крови;2024-03-25T12:35;1700;4986 2949 9253 9561
